{
  "schemaVersion": "1.0",
  "status": "PROPOSED",
  "targetPath": ".",
  "sourceDigest": "123c0d9f4d9fb413460497aa8517523e21e6f9dd4984471686369fd23e9ebc90",
  "components": [
    {
      "kind": "plugin",
      "name": "marketplace.json",
      "path": ".agents/plugins/marketplace.json",
      "purpose": "Plugin entry or plugin configuration",
      "confidence": "medium",
      "evidence": [
        ".agents/plugins/marketplace.json"
      ]
    },
    {
      "kind": "plugin",
      "name": "plugin.json",
      "path": ".claude-plugin/plugin.json",
      "purpose": "Plugin entry or plugin configuration",
      "confidence": "medium",
      "evidence": [
        ".claude-plugin/plugin.json"
      ]
    },
    {
      "kind": "documentation",
      "name": "create-issue.md",
      "path": ".claude/commands/create-issue.md",
      "purpose": "Repository documentation",
      "confidence": "medium",
      "evidence": [
        ".claude/commands/create-issue.md"
      ]
    },
    {
      "kind": "documentation",
      "name": "external-tools-health.md",
      "path": ".claude/commands/external-tools-health.md",
      "purpose": "Repository documentation",
      "confidence": "medium",
      "evidence": [
        ".claude/commands/external-tools-health.md"
      ]
    },
    {
      "kind": "documentation",
      "name": "handle-pr-comments.md",
      "path": ".claude/commands/handle-pr-comments.md",
      "purpose": "Repository documentation",
      "confidence": "medium",
      "evidence": [
        ".claude/commands/handle-pr-comments.md"
      ]
    },
    {
      "kind": "documentation",
      "name": "handoff.md",
      "path": ".claude/commands/handoff.md",
      "purpose": "Repository documentation",
      "confidence": "medium",
      "evidence": [
        ".claude/commands/handoff.md"
      ]
    },
    {
      "kind": "documentation",
      "name": "pr-shepherd.md",
      "path": ".claude/commands/pr-shepherd.md",
      "purpose": "Repository documentation",
      "confidence": "medium",
      "evidence": [
        ".claude/commands/pr-shepherd.md"
      ]
    },
    {
      "kind": "documentation",
      "name": "prime.md",
      "path": ".claude/commands/prime.md",
      "purpose": "Repository documentation",
      "confidence": "medium",
      "evidence": [
        ".claude/commands/prime.md"
      ]
    },
    {
      "kind": "documentation",
      "name": "review-design.md",
      "path": ".claude/commands/review-design.md",
      "purpose": "Repository documentation",
      "confidence": "medium",
      "evidence": [
        ".claude/commands/review-design.md"
      ]
    },
    {
      "kind": "documentation",
      "name": "self-reflect.md",
      "path": ".claude/commands/self-reflect.md",
      "purpose": "Repository documentation",
      "confidence": "medium",
      "evidence": [
        ".claude/commands/self-reflect.md"
      ]
    },
    {
      "kind": "documentation",
      "name": "start-task.md",
      "path": ".claude/commands/start-task.md",
      "purpose": "Repository documentation",
      "confidence": "medium",
      "evidence": [
        ".claude/commands/start-task.md"
      ]
    },
    {
      "kind": "plugin",
      "name": "plugin.json",
      "path": ".codex-plugin/plugin.json",
      "purpose": "Plugin entry or plugin configuration",
      "confidence": "medium",
      "evidence": [
        ".codex-plugin/plugin.json"
      ]
    },
    {
      "kind": "script",
      "name": "install.sh",
      "path": ".codex/install.sh",
      "purpose": "Supporting executable or automation script",
      "confidence": "medium",
      "evidence": [
        ".codex/install.sh"
      ]
    },
    {
      "kind": "documentation",
      "name": "README.md",
      "path": ".codex/README.md",
      "purpose": "Repository documentation",
      "confidence": "medium",
      "evidence": [
        ".codex/README.md"
      ]
    },
    {
      "kind": "other",
      "name": ".coverage-thresholds.json",
      "path": ".coverage-thresholds.json",
      "purpose": "Observed repository asset",
      "confidence": "low",
      "evidence": [
        ".coverage-thresholds.json"
      ]
    },
    {
      "kind": "plugin",
      "name": "README.md",
      "path": ".cursor-plugin/README.md",
      "purpose": "Plugin entry or plugin configuration",
      "confidence": "medium",
      "evidence": [
        ".cursor-plugin/README.md"
      ]
    },
    {
      "kind": "other",
      "name": ".gitattributes",
      "path": ".gitattributes",
      "purpose": "Observed repository asset",
      "confidence": "low",
      "evidence": [
        ".gitattributes"
      ]
    },
    {
      "kind": "workflow",
      "name": "ci.yml",
      "path": ".github/workflows/ci.yml",
      "purpose": "Automated workflow or repository action",
      "confidence": "medium",
      "evidence": [
        ".github/workflows/ci.yml"
      ]
    },
    {
      "kind": "other",
      "name": ".gitignore",
      "path": ".gitignore",
      "purpose": "Observed repository asset",
      "confidence": "low",
      "evidence": [
        ".gitignore"
      ]
    },
    {
      "kind": "documentation",
      "name": "README.md",
      "path": ".opencode/README.md",
      "purpose": "Repository documentation",
      "confidence": "medium",
      "evidence": [
        ".opencode/README.md"
      ]
    },
    {
      "kind": "agent",
      "name": "AGENTS.md",
      "path": "AGENTS.md",
      "purpose": "Agent instructions or agent metadata",
      "confidence": "medium",
      "evidence": [
        "AGENTS.md"
      ]
    },
    {
      "kind": "agent",
      "name": "architect-agent.md",
      "path": "agents/architect-agent.md",
      "purpose": "Agent instructions or agent metadata",
      "confidence": "medium",
      "evidence": [
        "agents/architect-agent.md"
      ]
    },
    {
      "kind": "agent",
      "name": "code-review-agent.md",
      "path": "agents/code-review-agent.md",
      "purpose": "Agent instructions or agent metadata",
      "confidence": "medium",
      "evidence": [
        "agents/code-review-agent.md"
      ]
    },
    {
      "kind": "agent",
      "name": "coder-agent.md",
      "path": "agents/coder-agent.md",
      "purpose": "Agent instructions or agent metadata",
      "confidence": "medium",
      "evidence": [
        "agents/coder-agent.md"
      ]
    },
    {
      "kind": "agent",
      "name": "cto-agent.md",
      "path": "agents/cto-agent.md",
      "purpose": "Agent instructions or agent metadata",
      "confidence": "medium",
      "evidence": [
        "agents/cto-agent.md"
      ]
    },
    {
      "kind": "agent",
      "name": "customer-service-agent.md",
      "path": "agents/customer-service-agent.md",
      "purpose": "Agent instructions or agent metadata",
      "confidence": "medium",
      "evidence": [
        "agents/customer-service-agent.md"
      ]
    },
    {
      "kind": "agent",
      "name": "designer-agent.md",
      "path": "agents/designer-agent.md",
      "purpose": "Agent instructions or agent metadata",
      "confidence": "medium",
      "evidence": [
        "agents/designer-agent.md"
      ]
    },
    {
      "kind": "agent",
      "name": "issue-orchestrator.md",
      "path": "agents/issue-orchestrator.md",
      "purpose": "Agent instructions or agent metadata",
      "confidence": "medium",
      "evidence": [
        "agents/issue-orchestrator.md"
      ]
    },
    {
      "kind": "agent",
      "name": "knowledge-curator-agent.md",
      "path": "agents/knowledge-curator-agent.md",
      "purpose": "Agent instructions or agent metadata",
      "confidence": "medium",
      "evidence": [
        "agents/knowledge-curator-agent.md"
      ]
    },
    {
      "kind": "agent",
      "name": "metrics-agent.md",
      "path": "agents/metrics-agent.md",
      "purpose": "Agent instructions or agent metadata",
      "confidence": "medium",
      "evidence": [
        "agents/metrics-agent.md"
      ]
    },
    {
      "kind": "agent",
      "name": "pr-shepherd-agent.md",
      "path": "agents/pr-shepherd-agent.md",
      "purpose": "Agent instructions or agent metadata",
      "confidence": "medium",
      "evidence": [
        "agents/pr-shepherd-agent.md"
      ]
    },
    {
      "kind": "agent",
      "name": "product-manager-agent.md",
      "path": "agents/product-manager-agent.md",
      "purpose": "Agent instructions or agent metadata",
      "confidence": "medium",
      "evidence": [
        "agents/product-manager-agent.md"
      ]
    },
    {
      "kind": "agent",
      "name": "release-engineer-agent.md",
      "path": "agents/release-engineer-agent.md",
      "purpose": "Agent instructions or agent metadata",
      "confidence": "medium",
      "evidence": [
        "agents/release-engineer-agent.md"
      ]
    },
    {
      "kind": "agent",
      "name": "researcher-agent.md",
      "path": "agents/researcher-agent.md",
      "purpose": "Agent instructions or agent metadata",
      "confidence": "medium",
      "evidence": [
        "agents/researcher-agent.md"
      ]
    },
    {
      "kind": "agent",
      "name": "security-auditor-agent.md",
      "path": "agents/security-auditor-agent.md",
      "purpose": "Agent instructions or agent metadata",
      "confidence": "medium",
      "evidence": [
        "agents/security-auditor-agent.md"
      ]
    },
    {
      "kind": "agent",
      "name": "security-design-agent.md",
      "path": "agents/security-design-agent.md",
      "purpose": "Agent instructions or agent metadata",
      "confidence": "medium",
      "evidence": [
        "agents/security-design-agent.md"
      ]
    },
    {
      "kind": "agent",
      "name": "slack-coordinator-agent.md",
      "path": "agents/slack-coordinator-agent.md",
      "purpose": "Agent instructions or agent metadata",
      "confidence": "medium",
      "evidence": [
        "agents/slack-coordinator-agent.md"
      ]
    },
    {